{"artifact_id":"artifact:6fbb7fb6748fc14f95970dc301c5bf5cdd3b18d57adbddbdf1002e524618294b","edges":[],"endings":[],"format_version":1,"nodes":[{"node":"node:00000000000000000000000000000001","unit_id":"1a15674196a3e4fa69b5c9f7393253f3ff91e62e8b3c6f45e7fc5d160b4bd458","x":0,"y":0}],"projection_version":1,"sources":[{"complete":true,"cursor":"commit:2098d8d635ed853d028c1f07745412bfd5adb1a45c971ab04f38c3a8a7aa9e56","frontier":[{"enabled":true,"label":{"key":"main.gate.wave","provider":"local"},"option":"option:00000000000000000000000000000001"},{"enabled":true,"label":{"key":"main.gate.nod","provider":"local"},"option":"option:00000000000000000000000000000002"}],"missing":[]}],"units":[{"content":{"key":"main.gate","provider":"local"},"segments":[{"first":"b1","last":"b1","unit":{"key":"main.gate","provider":"local"}}],"unit_id":"1a15674196a3e4fa69b5c9f7393253f3ff91e62e8b3c6f45e7fc5d160b4bd458","x":0,"y":0}]}