{"artifact_id":"artifact:6fbb7fb6748fc14f95970dc301c5bf5cdd3b18d57adbddbdf1002e524618294b","edges":[],"endings":[],"format_version":1,"nodes":[{"node":"node:00000000000000000000000000000001","unit_id":"1a15674196a3e4fa69b5c9f7393253f3ff91e62e8b3c6f45e7fc5d160b4bd458","x":0,"y":0}],"projection_version":1,"sources":[{"complete":true,"cursor":"commit:42b36614e9fe33e4b8febb2478bcf5c17e07ccf6b70291233a767bc587708c2f","frontier":[{"enabled":true,"label":{"key":"main.gate.left","provider":"local"},"option":"option:00000000000000000000000000000006"},{"enabled":true,"label":{"key":"main.gate.right","provider":"local"},"option":"option:00000000000000000000000000000007"}],"missing":[]}],"units":[{"content":{"key":"main.gate","provider":"local"},"segments":[{"first":"b1","last":"b1","unit":{"key":"main.gate","provider":"local"}},{"first":"r-wave","last":"r-wave","unit":{"key":"main.gate","provider":"local"}},{"first":"b2","last":"b2","unit":{"key":"main.gate","provider":"local"}},{"first":"r-rope","last":"r-rope","unit":{"key":"main.gate","provider":"local"}},{"first":"r-lamp","last":"r-lamp","unit":{"key":"main.gate","provider":"local"}},{"first":"b3","last":"b4","unit":{"key":"main.gate","provider":"local"}}],"unit_id":"1a15674196a3e4fa69b5c9f7393253f3ff91e62e8b3c6f45e7fc5d160b4bd458","x":0,"y":0}]}