{"artifact_id":"artifact:6fbb7fb6748fc14f95970dc301c5bf5cdd3b18d57adbddbdf1002e524618294b","edges":[{"choice_point":"choice-point:00000000000000000000000000000003","option":"option:00000000000000000000000000000006","source":"node:00000000000000000000000000000001","target":"node:00000000000000000000000000000002"},{"choice_point":null,"option":null,"source":"node:00000000000000000000000000000002","target":"node:0000000000000000000000000000000b"}],"endings":[],"format_version":1,"nodes":[{"node":"node:00000000000000000000000000000001","unit_id":"1a15674196a3e4fa69b5c9f7393253f3ff91e62e8b3c6f45e7fc5d160b4bd458","x":0,"y":0},{"node":"node:00000000000000000000000000000002","unit_id":null,"x":1,"y":0},{"node":"node:0000000000000000000000000000000b","unit_id":"74503211632eb76ba43ae5f3f05bd1ef1dbad31541102e7b6a9ba13d6d8e4373","x":2,"y":0}],"projection_version":1,"sources":[{"complete":true,"cursor":"commit:56b734e7e936598e9e45f2c5d7d736ca8fd8485d9f96e0b425336a4ed675be50","frontier":[{"enabled":true,"label":null,"option":"option:0000000000000000000000000000000b"}],"missing":[]}],"units":[{"content":{"key":"main.gate","provider":"local"},"segments":[{"first":"b1","last":"b1","unit":{"key":"main.gate","provider":"local"}},{"first":"r-wave","last":"r-wave","unit":{"key":"main.gate","provider":"local"}},{"first":"b2","last":"b2","unit":{"key":"main.gate","provider":"local"}},{"first":"r-rope","last":"r-rope","unit":{"key":"main.gate","provider":"local"}},{"first":"r-lamp","last":"r-lamp","unit":{"key":"main.gate","provider":"local"}},{"first":"b3","last":"b4","unit":{"key":"main.gate","provider":"local"}}],"unit_id":"1a15674196a3e4fa69b5c9f7393253f3ff91e62e8b3c6f45e7fc5d160b4bd458","x":0,"y":0},{"content":{"key":"side.talk","provider":"local"},"segments":[{"unit":{"key":"side.talk","provider":"local"}}],"unit_id":"74503211632eb76ba43ae5f3f05bd1ef1dbad31541102e7b6a9ba13d6d8e4373","x":1,"y":0}]}