{"artifact_id":"artifact:6fbb7fb6748fc14f95970dc301c5bf5cdd3b18d57adbddbdf1002e524618294b","edges":[],"endings":[],"format_version":1,"nodes":[{"node":"node:00000000000000000000000000000001","unit_id":"1a15674196a3e4fa69b5c9f7393253f3ff91e62e8b3c6f45e7fc5d160b4bd458","x":0,"y":0}],"projection_version":1,"sources":[{"complete":true,"cursor":"commit:a10d3dcd6dcdc3692f6a704019d2da47f185d5132f35c9ec3cc39a50e8c2e3d4","frontier":[{"enabled":true,"label":{"key":"main.gate.rope","provider":"local"},"option":"option:00000000000000000000000000000003"},{"enabled":true,"label":{"key":"main.gate.lamp","provider":"local"},"option":"option:00000000000000000000000000000004"},{"enabled":false,"label":{"key":"main.gate.map","provider":"local"},"option":"option:00000000000000000000000000000005"}],"missing":[]}],"units":[{"content":{"key":"main.gate","provider":"local"},"segments":[{"first":"b1","last":"b1","unit":{"key":"main.gate","provider":"local"}},{"first":"r-wave","last":"r-wave","unit":{"key":"main.gate","provider":"local"}},{"first":"b2","last":"b2","unit":{"key":"main.gate","provider":"local"}}],"unit_id":"1a15674196a3e4fa69b5c9f7393253f3ff91e62e8b3c6f45e7fc5d160b4bd458","x":0,"y":0}]}