{"artifact_id":"artifact:6fbb7fb6748fc14f95970dc301c5bf5cdd3b18d57adbddbdf1002e524618294b","edges":[{"choice_point":"choice-point:00000000000000000000000000000003","option":"option:00000000000000000000000000000006","source":"node:00000000000000000000000000000001","target":"node:00000000000000000000000000000002"},{"choice_point":null,"option":null,"source":"node:00000000000000000000000000000002","target":"node:0000000000000000000000000000000b"},{"choice_point":"choice-point:0000000000000000000000000000000b","option":"option:0000000000000000000000000000000b","source":"node:0000000000000000000000000000000b","target":"node:0000000000000000000000000000000c"},{"choice_point":null,"option":null,"source":"node:0000000000000000000000000000000c","target":"node:00000000000000000000000000000003"},{"choice_point":null,"option":null,"source":"node:00000000000000000000000000000003","target":"node:00000000000000000000000000000004"},{"choice_point":null,"option":null,"source":"node:00000000000000000000000000000004","target":"node:00000000000000000000000000000005"}],"endings":["node:00000000000000000000000000000005"],"format_version":1,"nodes":[{"node":"node:00000000000000000000000000000001","unit_id":"1a15674196a3e4fa69b5c9f7393253f3ff91e62e8b3c6f45e7fc5d160b4bd458","x":0,"y":0},{"node":"node:00000000000000000000000000000002","unit_id":null,"x":1,"y":0},{"node":"node:0000000000000000000000000000000b","unit_id":"74503211632eb76ba43ae5f3f05bd1ef1dbad31541102e7b6a9ba13d6d8e4373","x":2,"y":0},{"node":"node:0000000000000000000000000000000c","unit_id":null,"x":3,"y":0},{"node":"node:00000000000000000000000000000003","unit_id":null,"x":4,"y":0},{"node":"node:00000000000000000000000000000004","unit_id":null,"x":5,"y":0},{"node":"node:00000000000000000000000000000005","unit_id":"f26cb7b7e02dbff356c6a11285e532ee95f101bd9fb90a28fae2eee1e9446174","x":6,"y":0}],"projection_version":1,"sources":[{"complete":true,"cursor":"commit:b56535b9810f517d7b73c9a23f0f0fadf439803c2679bd1b8b985ffd9396a2f5","frontier":[],"missing":[]}],"units":[{"content":{"key":"main.gate","provider":"local"},"segments":[{"first":"b1","last":"b1","unit":{"key":"main.gate","provider":"local"}},{"first":"r-wave","last":"r-wave","unit":{"key":"main.gate","provider":"local"}},{"first":"b2","last":"b2","unit":{"key":"main.gate","provider":"local"}},{"first":"r-rope","last":"r-rope","unit":{"key":"main.gate","provider":"local"}},{"first":"r-lamp","last":"r-lamp","unit":{"key":"main.gate","provider":"local"}},{"first":"b3","last":"b4","unit":{"key":"main.gate","provider":"local"}}],"unit_id":"1a15674196a3e4fa69b5c9f7393253f3ff91e62e8b3c6f45e7fc5d160b4bd458","x":0,"y":0},{"content":{"key":"side.talk","provider":"local"},"segments":[{"unit":{"key":"side.talk","provider":"local"}}],"unit_id":"74503211632eb76ba43ae5f3f05bd1ef1dbad31541102e7b6a9ba13d6d8e4373","x":1,"y":0},{"content":{"key":"ending","provider":"local"},"segments":[{"first":"e1","last":"e1","unit":{"key":"ending","provider":"local"}}],"unit_id":"f26cb7b7e02dbff356c6a11285e532ee95f101bd9fb90a28fae2eee1e9446174","x":2,"y":0}]}